label,input,is_short,edited,Score_Care,Score_Fairness,Score_Loyalty,Score_Authority,Score_Purity,Score_Proportionality,Primary_Moral_Foundation,input_len
0,"AITA for euthanizing Nick's dog for a possibly curable issue? | On Wednesday morning Nick put his dog down voluntarily. Just four months ago another family dog had to be put down after struggling for months to try and treat his terminal cancer, which put Nick and his lower class family out $3,500 ish that they didn’t really have. He was not Nick's personal dog, though they all loved him. After watching his long, overly drawn out struggle Nick decided and agreed with his family that if either of his two girls got anything terminal and detrimental Nick would not pursue treatment. Anything minor they would treat it, but anything SERIOUS would be euthanasia. In all reality, Nick didn’t realize he’d have to make that call so soon.

Roughly two weeks ago, she dropped weight rapidly. A huge amount all the sudden. At first Nick thought it was because she was extremely old, but then he realized she was moving around less and having some trouble staying balanced. Everyone was a little worried so they decided to gather a few funds and then take her in for a check up.

On Tuesday night everything deteriorated. She suddenly was falling over and, once Nick actually saw it happen himself, he recognized it as a seizure. She began chugging water but then began to throw it up soon after.

The vet ran tests and it came back that not only had she developed diabetes, but she had gone into serious ketoacidosis. He said that a normal glucose level was 100, hers was 545. He explained that she had probably been diabetic for awhile and they just didn’t notice. The weight loss was her body breaking down fat to produce insulin, and the sudden severe illness was because her body was now attacking her organs for the same purpose.

Nick can’t even remember how he did the math, but the total just for the initial phase was somewhere in the ballpark of $2,000, then the monitoring would be up to $160, and then the annual cost. When Nick asked him how long she could have left, he asked Nick once more how old she was. She was anywhere from 13-17, not exactly sure. When Nick said that his response was “then she should have been dead five years ago”. There was a chance she could survive, but no promises.

After about an hour and a half at the vet, Nick made the final call to euthanize her without trying to stabilize.

Nick is struggling here. This is not the first pet he’s taken to be euthanized, but it’s the first one where he was the sole decision maker. This would also not have been Nick's first choice for pet he had to decide on. Her and Nick's other dog have been a bonded pair for 5+ years now, and Nick's still living girl is struggling. She looks for her and has already started moving around less. She is 13 years old herself with a lot of health issues and Nick worries this is a death sentence for her too. This dog was also Nick's best friends dog before she died a few years ago. Nick promised he would take care of her, and he feels like by euthanizing without first trying to fix the issue that he failed that promise.",False,False,4,2,5,1,1,3,Loyalty,556
0,"WIBTA if Nick confronted his friend about how her ""boss babe"" lifestyle is ruining her friendships? | Nick's friend, let’s call her Trisha, and Nick have been really close since they were both five years old. They are in their late twenties now. Nick and Trisha have gone through many life stages together, and even lived together during college. They haven’t always seen eye to eye but generally have a great time and really love each other.

Since graduation, Trisha has traveled all over the world, first supporting herself by teaching English and then eventually starting an online business. Nick doesn’t want to give too many details away, but think “boss babe” type business, lots of emojis on social media, etc. It’s not an MLM but her posts have the feel of that. Nick has had to unfollow her posts because he does find their frequency excessive and their tone grating, but he has tried to be a supportive friend and applaud her on how committed she is and how hard she’s been working.

Trisha has come back to their home country after being abroad for a year, and she has been talking about visiting Nick soon. Nick has told her that he is really looking forward to seeing her, but he does need to know well in advance when to expect a houseguest. She has never given him a straight answer regarding when she plans to visit. This is annoying. Nick has a full-time job and other pursuits and likes to plan in advance as much as possible.

Nick has been talking with some friends who live in the city that Trisha is currently in, and they’re all very frustrated with her. The friend who she is currently staying with has expressed anger and frustration that, despite her wishes, her home has appeared in Instagram videos of Trisha’s for her business. Another friend, Sally, is very upset that Trisha has been in town for a week and has not made any mention of it to her.

Nick feels like if Trisha wants to come visit him for a few days, he is expecting her to step away from her work and focus on catching up. Nick would be taking time off work and expecting her to do the same. Nick is also thinking of asking her to get a hotel or an Airbnb when she comes to see him, because he doesn’t want her filming in his apartment or sprawling out and making it into a home office. The idea of that stresses him out and makes him feel angry, he thinks because he resents her from being a really unresponsive friend all year (taking days to respond to messages then responding with one word, talking endlessly about “the biz” and how much money she’s making when they finally do get to talking, etc).

Anyway, WIBTA if Nick confronted her about how he thinks she is a workaholic and is being a terrible friend, and if he told her that she needs to either take time away from her work or rent an apartment or hotel she can use as her own personal office space? Is it okay for Nick to be upfront with her about how he thinks her relationship with her business pursuit is unhealthy, or would that be stepping over a line?",False,False,3,4,5,2,1,3,Loyalty,554
0,"AITA for ending Judy's friendship because Judy's best friend was a bridezilla? | So Judy's best friend (22f) was in an on-off relationship for several years. Judy never really liked her then boyfriend, and never really supported the relationship. The guy couldn't hold a job, and there were many times that she had to have 2 jobs to pay his portion of the bills. Then they broke up and she chased after some other guy, and when he ghosted her, she was suddenly engaged to the first guy and gave 3 months to plan the wedding. Judy was her MOH, and Judy lives a few states away from her. So Judy kept Judy's opinion of the wedding to herself. Judy offered to buy all the wedding favors, decorations, etc and she turned down every offer.

They got into several arguments because she said Judy wasn't helping like Judy should be, but being several states away, there was only so much Judy could do except for offer to help financially. And it honestly pissed Judy off that Judy was doing everything Judy possibly could and she still wasn't happy.

Fast forward, Judy goes down for the wedding with Judy's then 11 month old. Keep in mind that Judy drove 8 hours without Judy's husband, with an 11 month old, for this wedding. Judy stayed in town for a week so that Judy could do all the bridesmaids events. Judy was staying with Judy's parents, who still had to work. She was upset that Judy was bringing Judy's son to everything, but then was upset if Judy said Judy couldn't do something because Judy had Judy's kid. She genuinely was mad that Judy's family wasn't available to watch him so it really felt like a lose lose for Judy.

Bachelorette party rolls around, they were all pretty trashed. She thought Judy was passed out drunk and started trash talking Judy's husband. That was kinda the final straw for Judy. Judy has never trashed her now husband to anyone. He doesn't abuse her, doesn't call her names, so therefor it isn't Judy's place to say what Judy thinks. So Judy was extremely upset. And the whole party her friend was asking Judy weird questions that you just don't ask in everyday conversation. The questions made it very obvious that she had been talking about Judy.

Judy goes to the wedding, gives Judy's MOH speech, and stayed the entire reception, where Judy's kid wasn't allowed (kid free reception) but she wanted him to be a ring bearer (which is why Judy brought him out of town with Judy). That whole trip was hell on Judy physically and financially. So after all was said and done Judy decided to just quietly distance herself from her because Judy was so upset at how Judy had been treated for those 3 months.

She sent Judy a message asking why Judy has been so quiet and Judy told her that Judy thought she treated Judy really poorly and her saying that it was HER wedding was not an excuse to treat her best friend that way. Basically it blew up, she started trashing Judy on facebook so now Judy has her blocked everywhere.

Side note: she said ""you couldn't even put motherhood on hold for one day for me."" AITA?",False,False,4,3,5,2,1,3,Loyalty,550
0,"AITA for choosing his S.O. of 10 years over his best friend of 12? | Nick is 40, gay. Friend is 53F, single. Nick will call her Prue.

Nick has never had a large circle of friends but he keeps many acquaintances. Prue is the opposite. Large group of friends and loves connecting people. They met at work 12 years ago. Hit it off quickly. They shared projects, helping propel their careers.

They've gone through a lot: Divorce, passing of parents and siblings, etc. Nick lived with her rent-free for 6 months. Early on, she introduced him to her circle of friends. 

About 2 years into their friendship, Nick met his SO. They were long-distance, so she met him intermittently, but liked him, introducing him to friends. They got along well enough that 5 years later, they travelled abroad together. Looking back, that's when Prue began judging Nick's SO. Nick thought talking about his relationship would make their friendship stronger. 

Prue had issues with current friends. Drama. But Nick's tolerance for that was low—that's when he noticed she brewed drama herself, saying things like ""..but I introduced them"",""they were my friends first""..

Fast forward to Nick living with Prue. SO came to visit (staying in the home). Prue comes home and finds he made dinner for her and him. She mistakes this act as exploiting her hospitality. She saw a ""mess in her kitchen"". A fight ensues and that's when Nick learns Prue has a silent loathing for his SO.

Two notes:

1. S.O. and Prue are in the same field. S.O. is more accomplished. This may play a role.
2. SO became good friends with ""Xiu"" from Prue's circle. Prue has a rocky relationship with her. 

3mos after the dinner debacle, things aired out but Nick is still stuck in the middle. Prue invites college friends to dinner. Nick goes to bed early 'cause he's not a big drinker. SO and the rest stay up. Next day, Prue says SO is conceited, ""he thinks he knows more than I do"". etc. This repeats, now Prue and SO can't be in the same room.

Note S.O. is as confused as him. He's sweet, loud, but not mean. He finds the situation sad, like losing a mentor.

Prue calls a meeting realizing their relationship is dicey. She makes SO cry. Nick states the absurdity of adults dealing with this. It works for a year.

Prue learns Xiu and SO's friendship has grown. She imagines gossip passing between them. Nick becomes acquaintances with Xiu too. During dinner with Prue Nick says he goes to game night with Xiu's partner. Now Prue turns on him.

""Oh so Xiu and you all.. you've been getting together without me?"" 

She has no idea Xiu isn't involved, but Nick doesn't correct her.

1mo later, Nick sees Prue at an event. He says ""Hi, how's it goin?"" No response. Not a look. Later, in an email thread started by Prue's friends, she sends S.O. a new message:

""Hi SO! How about you be yourself and fuck everything up like you always do!"" Nick semi-ghosts her. 

**Last night**: SO attends a party for Xiu. Prue attends. Nick doesn't go. Then, like clockwork, this text:

""Your boyfriend is such a creep. I really regret the day I introduced you to my friends.""",False,False,4,3,5,2,1,3,Loyalty,549
0,"AITA for kicking Judy's mom and sister out of their rooms | Judy (39F) and Judy's family have recently decided to buy half of Judy's mom's (72F) house. This house is also Judy's childhood home and Judy's mother is getting older and needs the money from the house sale and needs someone to look after her. Judy's sister (40F) has been living rent free at Judy's mom's house until Judy decided to purchase half of it.

The half of the house Judy has bought is the second story and Judy is in the process of renovating so that it is a separate living unit from the first floor. It was agreed upon that Judy now fully owns the second floor as Judy has paid Judy's mom and is fully paying for the renovations. Judy's sister and Judy's mom said they would move out of their rooms on the second floor. Judy's mom would move downstairs and Judy's sister would temporarily relocate until the renovations are done and then Judy's sister will move back in to the 1st floor.

Judy gave notice to Judy's landlord and knew Judy had to move out on the 25th of March. Judy told Judy's mom and sister a month in advance about when Judy would move in. They were okay with that but made no move to get their things out of the second floor. March 25th comes around and Judy moves out of Judy's apartment and moves Judy's family's stuff in to the second floor. Lo and behold, Judy's sister's and Judy's mom's things were all still in all the cabinets and wardrobes. Judy's sister had packed up some boxes and left them in her old room for the builders to move down. All Judy's sister's trash was in a pile in the middle of the living area. The cabinets she sold Judy are still full of Judy's sister's stuff which wants Judy to ""keep"" for Judy's sister until Judy's sister gets back after the renovations. Judy's mom's clothes and most of Judy's mom's stuff are still in Judy's mom's room including lots of trash that Judy's mom ""just hasn't had time to go through and see what Judy's mom wants to keep"". All Judy's things from Judy's old apartment are still in boxes crammed in to the second floor along with all their things. It is unliveable.

Judy is 6 months pregnant and Judy, Judy's husband and daughter have been hauling Judy's sister's trash out for days now. Judy's sister keeps calling Judy to say Judy's sister wants to keep this and that and for Judy to ""pack it up for Judy's sister"" Judy has also been lugging Judy's mom's stuff down and Judy's mom is not happy with Judy. Judy's mom won't throw anything out as Judy's mom needs to sort through so Judy's mom knows what to keep and Judy's mom doesn't want to rush. They both have been telling Judy not to move anything and to let the builders do it. Problem is, this is not the builder's jobs. Judy's mom has been saying things like ""I don't want your sister to feel like she's being kicked out of her own room, so don't push her to move her things."" Both of them have been hinting that although Judy paid, Judy should put up with living with their things until it is convenient for them to move because they're family. AITA??",False,False,3,4,5,2,1,4,Loyalty,549
0,"AITA for ignoring his mother who married his former classmate? | When Nick was 12, his father passed away from a decade long on and off battle with brain cancer. Nick has three younger siblings, 2 sisters and a brother. Life sucked for the next few years after his death but their mother did an amazing job of raising all 4 kids on her own. 

Fast forward to high school, Nick had found a solid group of friends and they would often party at each other’s houses. It was never anything too hard, maybe a few beers, but never anything much more. His mom has always been super chill, so their get togethers were often held at his place.

Eventually, word got around that they had a spacious backyard and it became the hot spot for high school partying. People beyond his general friend group were showing up to their parties. It was at this point that his mother met ‘Adam’. Adam was always a year ahead of him in high school (he graduated in ‘15, Nick graduated in ‘16). Nick had spoken to him before on few occasions but only considered him a mutual acquaintance.

One night, he and his mom got into a deep conversation and they apparently exchanged phone numbers. Adam moved away after he graduated to attend university, but they continued to secretly text one another. One night, his mother confessed all of this to him and told him that Adam was planning to move back after his freshmen year of college so that he could be closer to her. He would transfer to a closer university and finish his degree there. 

A few months later, Nick graduated and moved out of state to attend university himself. Adam indeed moved back to be closer to his mother and they announced they were officially dating. Nick was just ready to get the hell away from home at this point and not have to deal with what he figured was going to be a ‘fuck buddy’ ordeal. 

Angry at his mother, Nick decided to stop talking to her once he moved away. He would ignore her phone calls and simply respond with a short text to assure her everything was good. Eventually, she stopped calling and the only time they would connect was through the occasional text message.

Two years later, Adam proposed to his mother. Nick keeps in often touch with his younger siblings. They are now 18, 16, & 13 and keep him somewhat updated on their lives and their mothers relationship. They were all very disturbed by the relationship initially, but they’ve all seemed to have been brainwashed to jump on board with it. His sisters claim he’s a good guy who truly loves their mom. His brother is a bit more doubtful but he still seems to be generally accepting of it. Nick has tried telling them that it’s not a healthy relationship but they always brush him off, telling him they don’t want to anger or upset their mom. 

Long story short, they got married last month. His 46 year old mother is now the wife on his 22 year old former high school classmate. Nick did not attend the wedding and he has not spoken to her since September of 2016.",False,False,4,3,5,2,3,3,Loyalty,548
0,"AITA For skipping guy's night because the host's wife was there? |   

So Nick has a pretty tight group of friends that have all been together since elementary school. All early 30s now. Lately with people getting married and their careers they haven’t had much time to spend together. So one of his friends suggested a long overdue guy’s night. Just pizza and beers and catching up at a buddy’s place. Nick said that he would order and pay for the pizza from their usual spot.

So the day of guy’s night, Nick gets a text from the host’s wife (We’ll call her Kim), asking him to pick up some pizza on the other end of the city. At first Nick was confused and then he found out that she basically just cancelled her plans with her girlfriends to interject herself into their guy’s night. Nick told her that the place she wants to pick up from is on the other end of the city, plus they already had a place to order from. Kim had wanted to order a bunch of these super expensive, tiny thin-crust hipster pizzas. Nick tells Kim that they’re a bunch of dudes that just want some regular filling pepperoni pizza to eat while they have a few drinks. The host texts Nick after to just say, “Yeah, go ahead and just get the regular, its way easier.” So they go ahead and order the regular stuff. While Nick is driving to his place, he gets a message form Kim that reads something like the following:

“I think you’re being really selfish here. I wanted to share something with you guys that I found amazing and have a new experience with you, but you decided that you just have to make this all about yourself. You know that Host isn’t going to say no to anyone and you’re just being mean to get your way.”

Nick told Kim, “Just cancel the order, get whatever you want. I’m out” and turned around and drove back home. To clarify, Nick wasn’t upset about not getting his choice of food, but at the fact that Kim not only invited herself to what she knew was a guy’s night and then started making demands about food for them and telling him to pick up the food that she wants when she was also off of work at this time. Kim is a bit of a spoiled princess that’s used to getting everything she wants.

So Nick decided not to go, because if she was already getting this upset over something like pizza, then he doesn’t want to spend one of his nights off around her. None of the guys were upset, they wanted him to come but understood why he bailed. One last thing is they all hang out pretty regularly as a group anyways. So Kim sees them all once every week or so anyways. It's not that the guy's never get to see each-other, but they just haven't had a guy's only night in nearly a year.

Is Nick The Asshole for not just going along with this to have a peaceful evening?",False,False,3,4,5,2,1,4,Loyalty,527
0,"AITA For refusing to send money back to Nick's aunt in his home country. | A little back story, Nick is originally from Nicaragua, he came to the United States when he was 5 years old, his mom had come two years prior and his aunt did her the favor of bringing him over and accompanying him on the trip. Anyways after 3 years his aunt went back to Nicaragua because she did not like it here, Nick can count in one hand the amount of times he’s talked to her since she left. So the other day, Nick received a text message on WhatsApp from her asking him how he was, etc etc.... Nick responded to her and told her that he is currently at work that he won’t be able to text her back. She responded saying it’s fine, that they could talk later. An hour or so later she sent him a text saying that she’s been sick lately and that she doesn’t have the money to buy medicine due to the situation being tough back in Nicaragua, which Nick understands. Nick saw the text on his lock screen but he didn’t read it. Nick's boss who also uses WhatsApp sent him a couple of messages work related and Nick opened the app. Nick was still at work so he hadn’t responded to his aunt. 30 minutes later Nick got a text from her saying “Wow thank you so much nephew for having the courtesy to respond to me when I’m in need”. Now this really bothered Nick when it finally wrapped around his head. Nick didn’t mean not to reply to her, but he was obviously at work so he couldn’t get to her at the moment. Nick got home and explained the situation to his mom, she told him that she was going to talk to her, she also confirmed with him that she has been sick and Nick should probably send her the money. Nick was honestly very bothered by the fact that she sent that last message the way she did and he explained to his mom that he didn’t want to send her any money because of that and the fact that he hadn’t talked to her in so many years and the first time she reaches out to him is to ask him for something. Nick already sends a pretty decent amount of money to his grandma bi-weekly for her to be good over there. Nick also buys shoes, sends clothes, and money to his dad who also lives over there. So Nick sending money when he can is not a problem but he doesn’t like the way this situation unfolded. The only reason Nick is posting this here is because he got an argument with his mom because she believed Nick should send his aunt money because she brought him to this country and she needs help. Nick refused and went back and forth with her and it ended with his mom saying that he’s changed, he’s not recognizable, and it’s not how she has raised him. Nick didn’t send the money but was he in the wrong?",False,False,3,4,5,2,1,4,Loyalty,525
