label,input,is_short,edited,Score_Care,Score_Fairness,Score_Loyalty,Score_Authority,Score_Purity,Score_Proportionality,Primary_Moral_Foundation,input_len
0,"AITA For Banning Judy's Sister's Ex Husband From Coming to Family Events and Causing Drama? | So this situation has been going on for some time now and Judy is turning to an outside source for critique. For context Judy is a thirty six year old women, her sister is thirty four. Her sister has three kids with her ex husband and Judy has four with her husband. They got divorced early 2019 because he’s been cheating on her with multiple women and even impregnanted TWO who both had abortions. This entire saga traumatized her younger sister and the divorce was rough.

Judy is completely disgusted with her ex brother in law and so is her entire inner family. They’ve completely cut contact with him. Her sister is the only one that communicates with him. Her parents, other siblings, extended family do not interact with him.

Judy always hosts family events at her house. Birthdays, Easter, Christmas parties etc. Her husband inherited a beautiful home so they have been the go to party throwers for years now. Ever since the whole divorce Judy doesn’t want her ex brother in law in her home. He’s no longer invited to any events. Her sister was upset and said that her kids would be upset to not have their dad at big events like this. She said she hates him for cheating but accepts that she has kids with him so they are stuck together for life.

But Judy has the right to not want someone she hates in her home and at her events. Judy stood by firmly and her husband agreed with her. Her kids got upset that Judy didn’t want their dad at any events and Judy's kids now hate their ex uncle (even though Judy hasn’t ever spoken to them about the situation). It was Judy's daughter's birthday this January and Judy was throwing a very extravagant party. Judy rented out an amusement park for the day and her daughter's entire grade came. Parents of course as they are fourth graders and her sister's son wanted his father there and of course Judy let him know her rule stands.

Her sister got upset and says that she can fight her own battles and that banning him makes Judy an asshole. Her sister has always allowed this guy to walk all over her and always defends him. Is Judy wrong for not wanting him at events and parties she throws? Judy just doesn’t see it.",False,False,4,3,5,4,3,3,Loyalty,412
0,"WIBTA if Judy legally changes her last name out of spite | So it’s a long story buckle up.  

Tonight Judy's dad and Judy got into a huge fight. Huge. Judy (24F) and her mom (47F) have not gotten her mom's disability pay and it’s a week late because of a problem at the bank and social security. Mainly because Judy's mom still has his last name on her social security stuff because social security didn’t accept her name change when they got divorced. Her license has her maiden name because the state accepted the name change from the divorce. The bank has Judy's mom's last name as her maiden name and keeps refusing her paycheck cuz the names don’t match up. She’s trying to get her social security changed to her maiden name but it’s taking a while.  

Judy accidentally messaged him about a problem that was supposed to go to a friend and it started the whole fight. He wants Judy's mom arrested for fraud, he wants Judy arrested for aiding and abetting. It was a whole huge fight and Judy finally snapped at him and told him to stop bashing Judy's mom and calling her lazy and stuff and stop bashing her to Judy because he’s so blinded by his hate for her.  

Judy's dad straight up admitted that he was betting on Judy failing in life because Judy loves her mother. He can’t love Judy like Judy's other siblings because Judy looks just like her mom. He was being a horrible person. So Judy finally told him to never speak to her and Judy blocked his phone number and his Facebook.  

Judy wants to pay the $200 to get her last name changed to her mom's last name. Judy doesn’t want to be associated with him anymore. He’s been emotionally abusive to Judy her whole life cuz Judy is close to her mom. This is the straw that broke the camels back tonight and Judy no longer wants to be his daughter.  

Judy's brothers are saying Judy is overreacting and Judy is an asshole for wanting to change her last name because they think it means Judy doesn’t want to be their siblings anymore. Judy's sister is neutral but she told Judy not to rush into it. Think it over. But Judy doesn’t have to think about it. Judy does not want to be his daughter anymore. Now Judy's brothers aren’t talking to Judy because they think Judy hates them.  

AITA?",False,False,4,3,5,2,1,4,Loyalty,410
0,"AITA for Nick being pissed off at his MIL's lack of concern for their house | Nick's wife and Nick went on a trip to see some family and asked Nick's in-laws to come over to their house to feed the dogs, let them out etc while Nick and his wife were gone (Friday morning to Sunday afternoon). Nick and his wife texted and asked on Saturday evening how the dogs were doing and Nick's MIL said that everything was fine and that Becky, Nick's sister-in-law, spent the night on Friday night and was going to spend the night again on Saturday night. Well Becky (17) has time and time again lost Nick and his wife's trust, she's known to steal, is promiscuous, all together just a rotten teen aged girl. Needless to say Nick and his wife would have said no to her spending the night. Nick and his wife were never even asked or consulted about such an arrangement by Nick's mother-in-law. They have alcohol, guns, money, all sorts of stuff Nick doesn't want anyone touching in his house. So after finding out about her spending the night, Nick called his neighbor to see if he saw anything funny. Nick failed to let him know Nick and his wife were going to be gone, Nick normally does but forgot. He is pretty good about watching what's going on in the neighborhood. Well he said at about 130 am, a guy in a truck pulled up and went inside Nick's house for several hours with another girl. The neighbor didn't know Nick and his wife were gone so he didn't think anything of it. So Nick texted his mother-in-law what was seen and that she needed to pick Becky up. After a long texting conversation and a phone call later they are all pissed off at each other. She blatantly won't admit to her f'up and tried to blame them for it and accused their neighbor of lying about the guy going to their house. Is Nick the asshole for being pissed off that his mother-in-law let her daughter spend the night without Nick and his wife knowing and it leading to two more people in their house that Nick and his wife didn't know? This is the last time they are doing this for them, they clearly can't handle their instructions.

TLDR: Nick and his wife go on a trip, in-laws watching the dog. MIL lets teen sister stay at their house with full access to their stuff and she invites other friends over. Nick and his wife weren't informed about this arrangement",False,False,4,3,5,4,2,3,Loyalty,410
0,"AITA for not giving Judy's brother money after he wouldn't be her kids' guardian? | Judy doesn't know how to feel about this situation so Judy is turning to internet strangers who at least won't know Judy's name if Judy is the asshole in this situation.

Judy's husband and Judy have 2 kids. Because Judy's husband and Judy both work in healthcare there's an increased chance Judy's husband and Judy could both die in the current situation. Judy's husband and Judy decided to update their will and decide their children's guardian. Judy's brother lives in the same city as Judy's husband and Judy with his wife and knows Judy's kids the best of all their close relatives.

Judy asked Judy's brother to be their children's guardian if both Judy and Judy's husband die.

Judy's brother replied, ""Whoa, that's a pretty big ask. ""

Judy said, "" Judy knows. Obviously take some time to think and discuss with Ann. Judy's husband and Judy would definitely be leaving money for the kids' needs, but they know you two the best. If Judy's husband and Judy both die, Judy's husband and Judy don't want them in foster care and Judy's husband and Judy want them to be with the people that know them best.""

Judy's brother immediately replied Judy's brother didn't need more time and definitely wouldn't be able to take them. Judy said ok and stopped the conversation there, but Judy was upset. Judy understands it's a lot to ask, but isn't that what family is for? To back Judy up when things go seriously wrong?

Judy didn't bring this up again with Judy's brother. A week ago, Judy's brother calls Judy and asks for a significant amount of money. Because of the current situation Judy's brother and his wife are out of work and they have a lot of loans and other bills to pay. Judy and Judy's husband couldn't give Judy's brother this amount of money without dipping into their savings. Normally Judy would have bit the bullet and after discussing with Judy's husband given Judy's brother as much as Judy and Judy's husband could. But now that Judy knows that if things get bad for Judy and Judy's husband, Judy's brother won't be there to help Judy, Judy isn't really motivated to help. Judy's brother got angry at Judy and accused Judy of refusing only because Judy's brother wouldn't take guardianship of the kids. Judy told Judy's brother that now that Judy knows that there may not be any back up if something happens to Judy and Judy's husband, Judy doesn't think it's a good idea for Judy and Judy's husband to make themselves financially unstable too. Judy's brother hung up and Judy hasn't bothered to call Judy's brother since.",False,False,4,3,5,2,1,3,Loyalty,405
0,"AITA for not hosting thanksgiving like Nick planned to | For about 50 years, Nick's mom hosted all of her children and grandchildren for thanksgiving and Christmas Eve. She’s now gotten too old and asked her kids to take over the tradition. There are 4 of them so they just rotate. They’ve each hosted one holiday so far. This thanksgiving was Nick's turn.

They had never spent thanksgiving or Christmas Eve with Nick's wife’s family. They’d just never been as close to them plus they live all over the country. Well this year Nick's wife’s mom and aunts decided to go to the Macy’s thanksgiving day parade. At first it was just a sister’s trip but then they decided to invite all their kids and grandkids to meet them up there.

Nick's wife really wanted to go. She hadnt seen some of her aunts and cousins in years. Their daughter wanted to go because it was a “once in a lifetime event” (which Nick agreed with). And Nick wanted to go.

As soon as they decided to go Nick called his older brother to see what they should do about thanksgiving because Nick couldn’t host that year. He said their oldest sister was going to be pissed and Nick had to tell her himself. He wished Nick luck.

So Nick called her and she was mad. She said she’d probably have to end up hosting even though she was up next for Christmas and Nick was being inconsiderate of what their mom asked them to do. “Mom wouldn’t abandon thanksgiving to go to nyc” and went on about how sad mom would be that Nick was doing this.

Nick offered to pay for them to rent a spot and have it catered but she said that took away from the close knit family vibe.

Nick's brother said his wife might be up for it but he didn’t sound too happy about asking her. Nick's other sister couldn’t do it because she was renovating her house.

Nick did feel bad for backing out of his turn but Nick tried to offer up solutions and Nick also offered to host the next holiday—which his oldest sister said no to because it was her turn and she’d been planning for it all year. Next up was Nick's brother so Nick said Nick and he could maybe just swap thanksgivings if his wife was up for it.

Was Nick in the wrong here?",False,False,3,4,5,3,1,4,Loyalty,403
0,"AITA For Nick putting his foot down to his grandmother? | Bit of background: Nick's grandmother and grandfather were together since Nick's grandfathers death a few years ago, they had a very traditional relationship where Nick's grandfather controlled all finances, big decisions etc, and Nick's grandmother would do the cooking and cleaning (note: she has worked in the past and has helped when Nick's grandfather had his own buisness).

Ever since Nick's grandfather passed away, Nick's grandmother has been very reliant on Nick's mum and Nick (aunt/Nick's mum's sister isn't very nice and lives quite a distance away) which makes sense. Due to bereavement, her memory has gotten a bit worse but she's had medical tests and there's nothing permanent. She needs glasses and a hearing aid (but refuses to wear them). Nick loves his grandmother but Nick is more protective of his mum. Nick can see that his grandmother constantly relying on his mum to do everything for her (besides bathe her) is taking a toll. Nick's grandmother is competent but doesn't want to learn how to do anything Nick's grandfather did for her.

Now the event that leads Nick to ask AITA: recently, whenever Nick's mum has given his grandmother a time to arrive, she is always an hour to two hours early. Even if these times are 9:00am, she will arrive at 7:30am. Even if she writes the time down, no matter how many times Nick's mum or Nick himself tell her a time, she is always early. This used to be just a bit annoying but now she has started barging in when Nick's mum is with clients (Nick's mum is a mental health adviser) and doesn't understand why Nick's mum won't give her attention/hang out with her. Nick put his foot down and said that it's getting too much and is getting in the way of Nick's mums work. Grandmother's response is that they treat her horribly and she wants Nick's mum to quit her job. Nick tells her ""you need to be on time, check your phone or watch for the time. 15 minutes early is fine but an hour isn't! Nick's mum is working."" She asks ""what do you expect me to do?"" Nick says ""be on time"" and she then leaves.

So reddit, AITA?",False,False,4,3,5,3,1,4,Loyalty,378
0,"AITA for not calling Judy's pregnant friend after Judy lost her baby? | So last spring and summer Judy got pregnant. When Judy told her best friend Judy noticed that her spontanious reaction was not joy for Judy but jealousy. She found her footing after a while and pretended happy.
Some weeks later Judy and her friend spoke about her friend wanting to have children. Her friend then told Judy that she thought she couldn’t get pregnant. Judy asked some follow up questions to her friend's concern, had her friend and her friend's husband tried for long? Had her friend seen a doctor about it? And so on.
Turns out the answer was none of this, ”it was just a feeling” her friend said. So Judy said her friend couldn’t know before she tried and her friend got pissed at Judy. Judy decided not to bring up the matter again since it was obviously sensitive.
Later that summer Judy lost her baby late in the pregnancy. Of course Judy's life was a mess and Judy needed her friend. Her friend never called. Judy called her friend crying once and her friend had nothing to say. Some more weeks went by and Judy started to feel stronger. Her friend invited Judy over for coffee.
As Judy and her friend sat by her friend's dinner table her friend told Judy she was pregnant and almost half way through the pregnancy. This means her friend got pregnant right after she told Judy she thought she couldn’t get pregnant.
Her friend then started talking about all the issues she has with work and other stuff during the pregnancy. She showed no respect for Judy's situation at all.
Also, during all the years Judy and her friend had known each other Judy was always there for her friend. When boyfriends left her friend. When her friend's mum passed away. Judy's door was always open whenever her friend called Judy.
And now her friend did this to Judy. It felt as if her friend wanted to get back at Judy for becoming pregnant before her. Judy left her friend's house devestaded and crying.
Judy did not contact her friend after that for a while. Her friend then wrote to Judy and said she missed Judy. Judy replied that her friend had hurt Judy and that Judy had needed a break from her friend. Her friend never replied to this.
Her friend's baby is due soon. Was Judy the asshole for not calling her friend?",False,False,4,3,5,2,1,3,Loyalty,377
0,"AITA Nick's friend asked him to be her bridesman, but Nick bailed during the bridal shower and bachelorette party because he felt uncomfortable. | So last year, one of Nick's best friends got engaged. They had been close for years as best friends and Nick was thrilled for her. Nick did not know her fiance, but she wanted Nick at her wedding and asked if he would be one of her bridesmaids, or a bridesman if you will. Nick got a chuckle out of the idea, but he really wanted to be there for her more than anything because friends support friends. Nick also lives in a different city and state, and he wanted to see someone whom he does not see often. So Nick said yes.

Nick is the only man in the group and did not know the other women before. He still does not know everyone. But he went to the bridal shower this past weekend, and Nick felt very uncomfortable. This was his very first one, too, and did not have any idea of what he was getting into. Nick is shy and doesn't always take to people immediately, but he thought the people there were not terribly friendly. He also forgot a gift (Nick is an asshole there no doubt).

The first game was seeing who had the most unique items in their purse. That was followed by games such as who knew the most about the soon-to-be-bride and guessing if the groom or the bride did ""these things first"". Nick was the only man there and just felt very out of place. He learned that the bachelorette party was changing, and was going to involve a sleepover.

Nick felt so uncomfortable that he faked a sudden family event and left the party as the bridal party was getting ready to party. He didn't want to tell his friend/bride that he was uncomfortable and lied.

Nick is openly gay. Nick has dabbled in what it means to be masculine his entire life. But the more he is in this role, the more uncomfortable he is. But Nick also believes that friends support friends, and he feels as if he is at a crossroads.",False,False,4,3,5,1,2,3,Loyalty,368
1,"AITA for confronting veterans Nick thinks are lying about their service or PTSD based on his own experiences? | Okay, so Nick is a veteran of 10 years. He was enlisted in the Marine Corps for 4 years and commissioned in the Army for 6. Nick is pretty laid back in a lot of things, but he can never ignore when someone tells obvious lies about their military service, and he feels compelled to confront them when they do.

Nick was not infantry in the Marines, but he served in an infantry unit for nearly 3 years, and he found that to be more in line with what he wanted to do. He got out, got his degree, and commissioned into the Army as an infantry officer, and got out as a Captain, which is when it stops being fun.

In Nick's time, he has seen a best friend bleeding out of his nose and mouth with 2 bullets in his lungs, knowing his kids were about to be orphaned by him and his wife would be a young widow (amazingly he loved, despite dying twice). Nick has been shot at, and blown up. He has had rockets fired at his base and when they were on patrol. Nick has known a 19 year old kid with the biggest grin who widowed his wife and orphaned his unborn child. He has known a young man who died after losing his lower half to an IED. He has known a brilliant friend who got taken out by small arms fire. And more than a few others who've gone the same way.

Whenever Nick and his wife are somewhere, be it a party, a restaurant, a store, wherever, and he hears someone talking about their service, he always listens in for the cliche key phrases. 95% of the time, it's a legitimate veteran, and he leaves it be and goes back to what he was doing, or they chat briefly about their time. 

Sometimes, however, Nick hears the phrases all of the liars seem to have learned in the same class. ""Oh, my job? They would tell me what to blow up, so I'd go blow it up."" That's not a job. ""I was a sniper, but I cant talk about it because so much was classified."" Then why'd you bring it up? ""I hung out with Special Forces so much they wound up taking me on missions."" Bull. Shit. 

Also, when they start talking about their supposed PTSD. Now, Nick has PTSD. He knows plenty of people ACTUALLY suffer from it. But a lot of people lie to create these movie scene quality breakdowns for attention. 

Whenever Nick is faced with someone doing this, he starts the usual litany of questions to let them talk themselves into a hole. Things like their unit, base, when they deployed, where they went, what their MOS was specifically, things like that. Usually, they start getting more and more vague, or they'll chuck out the ol' standby that most of what they did was classified. At a certain point, he will just say ""You're a fucking liar and everyone around you knows it now.""

Nick's wife thinks it is him being confrontational, and she doesn't call him an asshole, but she hates it. She thinks that he should just ignore it, and focus on other things. For Nick, it is because he sees someone claiming a false comradeship with a group of men and women that went through things they're only pretending to have gone through, and he hates it. To him, its disgustingly offensive, and he can't help it.

AITA for confronting them like Nick does?",False,False,3,4,5,2,3,3,Loyalty,601
1,"AITA for telling Nick's step aunt that her “parents” are not her real parents? | Nick's mom married Nick's stepdad when Nick was 5. They would visit his parents every five years or so. Nick's step grandmother had 4 children with her first husband.

When she got remarried, Nick's stepdad and his brother were both in their late teens so they remember this situation very well. Since Nick wasn’t there, Nick will tell you the story from their POV.

When Nick's stepdad was about 17, his little sister who was 15 at the time, got pregnant. Nick's stepdad clearly remembers her being pregnant. Very early into the pregnancy, Nick's stepdad's sister was “sent away” and about 7 months later, she reappeared and magically Nick's step grandmother had a newborn baby with her new husband. From the moment that happened, obviously everyone knew that Nick's step aunt had had a baby and given it to Nick's step grandparents. But no one ever wanted to rock the boat and confront them. Also, years later Nick's aunt who had the baby wrote a letter to her other brother detailing what had happened and how sad she was about it. So there is no doubt that she gave the baby to Nick's step grandparents.

That child became what Nick knew to be Nick's step aunt who was only about 7 years older than Nick. In reality, she was Nick's step cousin. Nick along with Nick's siblings, cousins, everyone from that side of the family, grew up knowing the truth. Except for her.

Fast forward to 2008. Nick moved to NYC. Nick's step aunt happened to also move to NYC a year or so after Nick. They had never been super close due to the geographic distance between their families but Nick's parents encouraged Nick to text her and hang out due to being in the same city and also being so close in age. They instantly bonded. They had the same interest, the same sense of humor and rapidly became very good friends. Friends more than family. They hung out with each other weekly for the next 6 years. All along, Nick knew this deep, dark, horrible secret but Nick could never bring himself to tell her because Nick didn’t know what it would do to her.

In 2015, Nick left NYC and moved to Florida where she had grown up and where Nick's step grandparents resided. They also were not super close but due to Nick's extremely close friendship with Nick's step aunt, they started inviting Nick over frequently.

In January of this year, Nick was talking with Nick's step aunt on the phone. They stayed close even though Nick had moved away and would text or chat often. Nick finally decided that Nick had had enough of the lies and that if no one else in the family was going to tell her what they all knew, that Nick was going to do it, because she was Nick's friend. Nick's parents and close family from that side all supported what Nick had done and even spoke to Nick's step aunt to back up what Nick had told her with more detail.

Nick's step aunt on the other hand was enraged. She called Nick a liar and told Nick that what Nick did was beyond hurtful. Nick's step grandfather also called Nick a liar and asked why Nick wanted to hurt the family so much.

Needless to say, Nick hasn’t heard from Nick's aunt or her parents since this happened. And Nick keeps asking himself if Nick did the right thing.

AITA?",False,False,4,3,5,2,1,3,Loyalty,599
