label,input,is_short,edited,Score_Care,Score_Fairness,Score_Loyalty,Score_Authority,Score_Purity,Score_Proportionality,Primary_Moral_Foundation,input_len
1,"WIBTA if Judy dates Judy's ex's brother? | Very long story short, Judy was married to ""Robert"" for almost a decade. They got married very young, Judy was 21, and Judy just wasn't ready for marriage. Judy hadn't seen the world, was working a dead end job, had zero life or relationship experience outside of him, was just a small town girl who fell into the ""get married young"" life script.

In the time that they were together, Judy went to college which he paid for with his money from his job (trucking). He spent about $20K on Judy's 3 years of school. Judy got Judy's associates and passed the NCLEX and started as an RN. With the money from Judy's job, Judy gave him $30K a few years later that he could use as the down payment for his own commercial truck. Judy gave him a little bit more than he gave Judy because Judy was only working part-time while Judy was in school and he was paying most of the bills. Other than that, they'd kept their finances separate and paid for things 50/50.

Like an absolute freaking idiot and terrible person, Judy had an affair with a supervisor. It's one of Judy's biggest regrets. Judy is not gonna blame it on anything, it was Judy's fault and it breaks Judy's heart to know Judy broke such a good man. Robert was devastated when he found out and to this day, it's been two years since their divorce, he's still a different person than he was before.

Judy has stayed close with his parents and siblings because they have known each other for 15+ years and have always gotten along. Robert is still friendly with Judy's brother and parents as well but they don't talk to each other.

Robert's brother, Chris, and Judy have always been really friendly. He lived outside of their hometown for the past few years but moved back recently and has always been great to Judy. Judy thinks because he didn't live here when the divorce went down, he doesn't hold it against Judy at all. He's told Judy that he somewhat understands where Judy was coming from because Robert can be emotionally distant but overall he's been honest to say that Judy shouldn't have done what Judy did. Judy agrees with him.

Chris & Judy have a lot in common and have been hanging out a lot recently. He said to Judy point blank: ""listen, my family will be mad if you and I get involved but I'm willing to take the heat if you're willing to take this thing serious"" and Judy honestly is. He's a really great guy, but the problem is Judy doesn't want to hurt Robert anymore than Judy has. He's dating again and seems happier, but Judy is still not sure. Would Judy be the asshole if Judy dated Chris? He and Robert aren't that close btw due to age & personality difference.",False,False,4,3,5,2,2,3,Loyalty,488
1,"AITA for asking the husband's sister to consider being a surrogate for them? | The husband and Judy had been trying for pregnancy for years, and to cut a long story short it seemed as though it would never be a possibility. It took a long time to come to terms with but the couple had gradually gotten there. Their entire family was aware of the journey the couple had been on and how much it meant to them. With that in mind, the husband and Judy came to his sister (Sarah) with a proposal.

Sarah was in her early 30s, unmarried, and vocally against having children of her own. Despite this the couple thought she might be open to the idea of a surrogate pregnancy on their behalf given she would not have to be involved in raising the child personally. The husband was extremely close to his family and the idea of the entire process of surrogacy being contained to his blood felt extremely important to him. With that closeness in mind, the couple did not feel it was out of order to ask that sort of question.

They invited Sarah over for dinner and at the end of it laid out their request. They told her they had been saving over the years and would be willing to pay her as much as a regular surrogate would be paid (a pretty hefty fee so she would be able to take time off from work if it was required), help her out with everything she needed, plus they had no expectations that she must help raise the child just because she carried it. They told her why it was important to them and how much it'd mean, and asked her to have an open mind about it.

Sarah exploded at them. She said they were both out of their minds for making such a request, extremely selfish, and that they had no respect for her disinterest in children. She actually left early. Right then she was refusing to take calls from them and even went as far as to ask the husband's parents to tell them both not to contact her until she decided to initiate it herself. The husband's parents were sympathetic to them but said that they should have kept in mind Sarah's difficulties. Judy's parents thought she was behaving awfully. Most of Judy's friends were on Judy's side but a few had said that it was a bit of a rude request given everyone knew how much Sarah hated kids.

It was really weighing on Judy's mind and Judy honestly never expected that kind of outcome. She literally blocked them on every platform she could. Were they really the ones behaving like an asshole?",False,False,3,4,5,1,2,3,Loyalty,452
1,"Is Nick the Asshole for getting angry at his friend who needs a ""break"" from the friendship? | Nick (28M) has an old friend (29F) whose friendship has become relatively low maintenance over the years, where at times months pass without them seeing each other. They still have infrequent communications by text/phone call, and whenever they do meet, it’s as though no time has passed – they catch each other up on life, commiserate about shitty things going on, and reminisce about old times (a healthy, functioning adult friendship, in Nick's opinion). 

The past 12 months at work had been intense, Nick was travelling interstate for weeks and months at a time and was hardly ever in his home city. Nick saw his friend twice during that period (once for her birthday where Nick dropped in for dinner and had to leave early to attend another event, and again for Nick's birthday where they had a one-on-one catch up). Nick is now back in his home city, and life has returned to its normal pace.

About a month ago (June) Nick realised his friend hadn’t responded to his calls and text messages for about two months (April/May). Nick put it down to life being busy, but just to be sure Nick sent a text message and left a voice message along the lines of: “Not sure if you’re getting Nick's calls/texts, but Nick hasn’t heard from you in a while. Nick doesn’t want to seem neurotic, but are we cool?”. 

Nick expected a tongue in check response, but Nick was served a proper essay about being an absent friend, being generally selfish, and not making the time, and, because of that, she “needed a break” from him. She cited Nick's leaving early from her last birthday as a major issue. It took the wind out of Nick's sails. This was one of Nick's oldest friends. Nick tried to call back as soon as Nick read the message, but the phone rang out. 

Nick sent back a pretty defensive text message asking her why she left it so long without saying anything, and apologising. It was angry in tone, Nick guessed. Nick got nothing back. Today, Nick sent another text message, but this was a lot angrier in tone. Nick feels like Nick is being cut out, and Nick can’t see how Nick is in the wrong. Is Nick missing something? 

Nick reached out to a mutual friend for an objective opinion, and he said Nick is the asshole for not respecting that she “needs space”. Nick thinks this is a cop-out. They hardly see each other as it is, yet she needs more space. Is Nick being unreasonable?

Is Nick the Asshole?",False,False,4,3,5,2,1,3,Loyalty,447
1,"Update: AITA for hosting a family...but making a peanut dish so sister and family couldn't come. She's trying to blackmail Nick, tithe to her mega church or pay nieces ER bill! | Since pretty much everyone thought Nick was the asshole there (Nick accepted his judgement but didn't agree) Nick thought Nick would update with the latest shots fired in this war. It started when Nick and his sister were kids but became nuclear when Nick tried to wear a thong bathing suit on the beach.

This is the original from Saturday: https://www.reddit.com/r/AmItheAsshole/comments/b7blaf/aita_for_hosting_a_family_dinner_but_making_a/

So late last night Nick's sister called. Nick honestly didn't want to answer but Nick took what people said to Nick to heart and figured at some point Nick and his sister needed to bury the hatchet and at least Nick's sister was reaching out. So Nick answered and Nick ALMOST fell for it. Nick's sister started in by saying Nick and his sister were sisters and Nick's sister would always love Nick and Nick and his sister were the two oldest and Nick and his sister needed to set an example for all of Nick's mother and daddy's grandkids. Nick told his sister Nick agreed. Nick's sister said she would try harder to. Nick said Nick was sorry for not understanding the dangers of the peanut allergy.

Then since Nick's sister is literally the most evil person on the planet, she took Nick's apology and said ""about that, we aren't sure insurance is going to cover the ER visit and Nick and David do think Nick should be responsible."" Nick told his sister that she knew what Nick was making a week in advance. Nick's sister ignored Nick and told Nick ""David and Nick know Nick has strayed from the church in recent years which is why Nick and David think Nick and his sister have so many problems. Nick and David would gladly accept Nick giving an equal amount to Nick and David's church and Nick and David will call it even. Nick and David want Nick back with Jesus.""

So Nick's sister belongs to a Joel Osteen Mega church rip off (if anyone lives anywhere near NW Florida they know exactly who Nick is talking about). There is no way in hell Nick is going to be out of work and pay his sister's BS church a cent. Nick told his sister Nick wasn't going to be shaken down like that. Nick's sister said it was for the good of the family. Nick told his sister she was the one at fault for all of that by treating Nick like shit for Nick's entire life and Nick hung up on his sister. Nick's sister tried to call Nick back 10000 times but Nick didn't answer and Nick loved the thought of his sister redialing over and over again. The war goes on.",False,False,3,4,5,2,1,4,Loyalty,424
1,"AITA for Judy wanting to let Judy's family know Judy's daughter is getting married and post one or two pictures of the cake Judy's baking on social media? | Judy's daughter is getting married to her boyfriend of 2 years at the courthouse next week, while he's on leave from the army. This is not a shotgun wedding. They do not plan to have kids for the foreseeable future (if ever.)  

They intend to have a proper wedding in the future, when finances allow. However, in the meantime, she's forbidden Judy from mentioning it to anyone in Judy's family or even friends of Judy's who know her, but do not know the family.  

These are kids who never had an apartment and want Judy and her husband (the parents) to give them what they need to get started. It's a financial imposition to ask Judy and her husband to furnish their house, and Judy knows that both Judy's family and the groom's family would be delighted to help if they could.  

In addition, the groom's family all knows this is going to happen and Judy feels Judy's family will be terribly hurt if they are shut out completely. Judy and her husband are not inviting people to the courthouse, obviously, but they can call and offer their Congratulations anyway. Judy's worried that, when they finally do have their wedding, nobody will want to come because they weren't even given the dignity of a notice.  

Further, Judy makes lots of crafts and baked goods. Judy likes to post the projects on social media for critiques and she's forbidden Judy from posting the wedding cake picture. Her real wedding will have a professional cake, but Judy wanted the practice, and only a few people will be there. Frankly, Judy's enthusiasm for helping her is dwindling and Judy is contemplating *not* baking the cake, as literally this exposure was all Judy wanted.  

Judy's also thinking of offering her less for setting up house. Judy's original thinking was, they could save up faster if they don't have to buy furniture and dishes. But she won't let Judy and her husband enlist the help of others. Judy and her husband have to replace what they give her and do without in the meantime, because they don't have money to buy these things right now. They're willing to do this for their comfort. It sure would be nice to see if anyone else is planning on getting rid of some old furniture or dishes so they can get started.  

Is Judy being an asshole?",False,False,3,4,5,2,1,3,Loyalty,412
1,"AITA For telling his fiancé that Nick loves his female best friend? | Nick has been engaged to his fiancé for about two months, and before that they dated for six months, so they've been together a total of eight months. Throughout that entire time, she has never been comfortable with his relationship with his female best friend who Nick has known since high school.

His friend is someone very special, and very close to him. She is smart, caring, beautiful, and an extremely loving and funny person. She honestly does mean the world to him and since freshman year in highschool she has been the one who has been with him through so many events in his life, including his moms passing.

His fiancé has been in his life for eight months, and can't understand the bond that Nick has with his best friend. She has openly told him that it makes her uncomfortable how Nick spends time with her. Nick usually tries to change the subject but now that they're engaged shes become a lot more hostile to both him and his best friend.

What really pissed him off is that she almost drove his best friend to tears recently over dinner, basically indirectly criticizing her for always hanging around someone elses man instead of finding her own.

Nick confronted his fiancé in private and she just asked him to not invite her to the wedding. Nick put his foot down and said that he loves her, and that the type of relationship he has with her comes once in a lifetime. Nick may have also crossed the line in the heat of the moment by calling his best friend his soul mate, as he was just trying to articulate how much he loves her as it does goes beyond just being a best friend.

His fiancé basically breaks down crying, (she does this a lot to get her way) and says that Nick must hate her. Nick says Nick hates the way she's acting. She then asks what his friend has that she doesn't, and Nick decides not to engage any further.

Later Nick tells her the truth of the matter is that he loves them both, and he just wants everyone to get a long. She says im being emotionally abusive for telling her that he loves another woman.

AITA For telling his fiancé that Nick loves his female friend, or is she just being unreasonably jealous?",False,False,3,4,5,2,1,3,Loyalty,410
1,"AITA for lending his niece his daughter's suit for a job interview? | Nick's daughter Rachel is 25. She works in finance. Given that she's meeting clients all the time she needs to dress to impress. She's heavily into fashion and likes the best stuff. She earns a high salary and chooses to get tailored suits crafted from scratch. They're truly beautiful pieces which give her a very professional and serious look.

Nick's brother, his brother's wife and their 18 year old daughter Chloe popped in today for lunch. She has a job interview tomorrow for an IT apprenticeship. Apparently she was one of very few who made it to the interview stage, and the company's interviews are notoriously harsh. Unfortunately she doesn't think she has anything she could wear to the interview. She does have some ''formal'' clothing but according to her its more the stuff you wear at a wedding rather than something professional for a job interview.

In spite of the age difference Rachel and Chloe are quite close in both height and build. Although Rachel's suits are tailored to her, Nick thought they would still look nice on Chloe.

Nick took some stuff out of Rachel's room and suggested Chloe try them on. She ended up really liking one of Rachel's dark suits. She looked amazing in it and Nick imagines she'll look very professional in the interview room. Nick let her take the suit and give it back after her interview.

Rachel was out with her friends today, and when she got home Nick told her about the day. When Nick told her Chloe took one of her suits she went mad, saying how dare Nick touch her things, calling him a ''fucking idiot'' and storming off and slamming the door like a teenager.

Nick had a chat with his husband, and with some thought Nick agrees that Nick should have asked Rachel before he gave Chloe her stuff, but even so Nick did it to help out a family member which is hardly a bad thing. Rachel's reaction was also extremely over the top. She had a tantrum like a teenager and sulked in her room all day. She's acting like a spoiled brat.

Did Nick do the right thing?",False,False,3,4,5,2,1,3,Loyalty,375
1,"AITA for telling his wife that Nick loves his family more than his in-laws and his family probably doesn't care about Judy like they care about him? | Nick and Judy have been married for 3 years and together for 6. Nick gets along with Judy's family just fine but Nick is a strong believer that in-laws and spouses should keep a polite distance and not get too comfortable and not love each other too much. Nick is very close to his 3 brothers and 2 sisters as well as his mother. Judy said that her family wants to see her and him together for New Year's Eve but Nick would prefer to spend it with his own family instead because that's where Nick feels more comfortable and that's where Nick can be himself but when Nick is around her family, Nick is basically on his best behaviour. That's why Nick rarely visits them or even talks to them on the phone. Whenever one of Judy's family calls her on her FaceTime, Nick quickly removes himself and goes to another room. Usually Nick's basement/gaming room and Judy always calls Nick out saying it's rude to walk out of the room when her family calls her despite that Nick keeps telling Judy that Nick is trying to give her the space she needs just in case Judy is talking about personal stuff that Nick doesn't need to hear but Judy calls bullshit at that because Judy says that when Nick talks to his family on the phone, Judy always makes the effort to talk to them but Nick never asks Judy to do that and his family doesn't care that much about Judy. Yesterday Judy got mad at Nick for not spending Christmas with her family and for planning to spend New Year's Eve with his own family and Nick basically told Judy that while Nick likes her family, Nick loves his family more and his family loves him more than Judy. Now Judy has been giving Nick the silent treatment and Nick doesn't understand why Judy acts like that? Is Nick an asshole for admitting what Nick admitted?",False,False,2,3,5,2,1,3,Loyalty,365
1,"AITA for Nick wanting to cut off contact with a friend and the widow of a late friend because they're dating now? | Title is horrible but hear Nick out.

Nick has been hanging out with this group of friends for about 11 years. Some Nick met during college and others got into it as the years went by. Last year the group lost one of their friends, Michael, because of a cardiac arrest. Michael was married, had been for 4 years and knew his wife for even longer than that. In the same group there is Adam, who was friends with Michael since high school and got into the group at the same time Michael did.

Now the issue that is the reason behind this post is that Adam has told the group a couple days ago that he's dating Michael's widow. They were all surprised by this because they never saw it coming. After Michael died they all did their best to provide comfort and support for her, Adam included, but as far as they knew and as far as Adam told them at the time they were just hanging out/having talks when she needed. Now they get to find out Adam and the widow have been getting to know each other better for at least 6 months. When Michael has been dead for 1 year and 4 months.

This has split the group in three. The ones that believe that Adam and the widow should be allowed to do whatever they want and don't see a problem with it. Then the ones that believe Adam is taking advantage of Michael's widow. And the ones that think they're both wrong and also don't want to be around Adam and her anymore.

Nick is with the last group. Yes, everyone deals with grief in different ways but this doesn't sit right with Nick and Nick also thinks it's just a tasteless thing to do. Nick and others have said that they would not keep hanging out with Adam and also they would not keep in touch with Michael's widow. If Adam and the widow were free to do whatever they wanted they also should deal with the consequences of this. So, are they being assholes in this?",False,False,4,3,5,2,4,3,Loyalty,363
1,"AITA for hosting a family dinner but making a Thai peanut dish specifically so Judy's sister and her kids couldn't attend (too spicy and allergic to peanuts)? | Hello again AITA, you guys have previously weighed in on the long running battle between Judy and her sister so Judy figured she'd turn to you again to see if she really messed up. Judy is always on her family's bad side so Judy appreciated the neutral input last time.

Somehow it's become a tradition in Judy's family that one family member host a Friday night dinner once a month. Last night was Judy's night. Judy's oldest sister and Judy have not been speaking since their vacation (click on user name to see why if you're curious) and Judy was able to avoid her at the January and February dinner at other's houses. Judy really, really didn't want her in her apartment. So Judy decided since she hates spicy food and her kids are allegedly allergic to peanuts, Judy could side step the  issue and make this Thai peanut noodle dish that Judy loves. Judy announced it well in advance in the group email what Judy was planning. 

Well since Judy's sister is much more diabolical than Judy gives her credit for, she had her husband drive the 2 hours to Judy's place, feign that she didn't know Judy was making something that allowed her to say ""you know my family can't eat! Isn't the point of a family dinner so all the family can enjoy!"" While clutching her pearls (literally). Then Judy's niece claimed she could feel the ""peanut residue in the air"" and it was affecting her ability to breathe. So Judy's sister dramatically took her to the emergency room where all turned out to be fine.

But again, Judy lost. Judy's sister played her like a fiddle and the entire family took her side. Dinner was ruined and Judy is the bad guy. Again. Judy honestly just tried to side step the issue of having her around but making somthing she and her kids couldn't eat--and announcing it well in advance.

Judy's family thinks she is the asshole. Is Judy the asshole?",False,False,4,3,5,2,1,3,Loyalty,360
1,"AITA for declining to be a bridesmaid for one girl in Judy's group of friends? | Judy (29F) had been part of a friend group of five girls for the past 11 years. They met through a student organization they were all involved with their freshman year of college and had been very close ever since. Let's call the other girls Ariel, Brianna, Carmen and Dana.

Judy was the first to get married five years ago and she made all four of the girls her bridesmaids. Ariel, Brianna and Carmen all got married within the past two years and Judy was a bridesmaid in all three of their weddings. Judy was also a bridesmaid for her sister and two cousins around this time period, and between all of the dresses, hotel costs, flights, bachelorette parties, bridal showers and gifts, it ended up becoming a massive financial strain that ultimately cost Judy thousands and thousands of dollars, not to mention tons of vacation days. After Carmen's wedding, Judy decided she was done being a bridesmaid, it was just too much.

Dana didn't have a lot of luck with relationships and was single for pretty much the entire time they were friends, but she finally announced she and her boyfriend are engaged. They were all thrilled for her, of course, and she asked all of them to be her bridesmaids. Judy gently told Dana that her days of being in a wedding party were over, but she would be happy to support Dana in other ways, such as helping with centerpieces and general wedding planning, and Judy would be there for sure on the big day.

Dana blew up at Judy and said it wasn't fair that Judy had been a bridesmaid for the other three girls but wouldn't do it for her. Dana said it had been really hard for her to always be the single friend at all of their weddings and now that it was finally her time to get married Judy owed it to her to be a bridesmaid.

Judy gets Dana's perspective, she really does, but Judy really doesn't think she has any such obligation. AITA?",False,False,3,4,5,2,1,4,Loyalty,359
